"Sort Key","Type","Name","Version","Name Space Id","Description","Steward","Value Type","Minimum Cardinality","Maximum Cardinality","Minimum Value","Maximum Value","Minimum Characters","Maximum Characters","Unit of Measure Type","Specified Unit Id","Attribute Concept","Conceptual Domain"
"nh:Detector:1                      ","Class","Detector","1.0.0.0","nh"," The nh:Detector class provides observation metadata relevant to the specific detector (an instrument may have more than one detector) used to collect the data. ","sbn","","","","","","","","","","",""
"nh:Detector:2                       nh:detector_name:1                 ","Attribute","detector_name","n/a","nh"," The nh:detector_name provides the identifier of the detector that recorded the observation(s) comprising the product. For instruments with multiple detectors, as in the case of MVIC, for example, this string will include both the instrument ID and the specific detector ID. ","sbn","ASCII_Short_String_Collapsed","1","1","Unbounded","Unbounded","1","255","Units_of_None","none","TBD_classConcept","SHORT_STRING"
"nh:Detector:2                       nh:detector_name:2                  Value:Alice spectrograph","Value","Alice spectrograph","",""," Data were obtained using the Alice spectrograph. The Alice UV spectrograph has a spectral passband of 520-1870 Angstrom, a spectral PSF of 3-6 Angstrom FWHM, and an instantaneous spatial field of view that is 6 degrees long. "
"nh:Detector:2                       nh:detector_name:2                  Value:LORRI imager","Value","LORRI imager","",""," Data were obtained using the LORRI imager. LORRI is a high-resolution panchromatic imager with a spectral passband of 350-850 nm. "
"nh:Detector:2                       nh:detector_name:2                  Value:Linear Etalon Imagin","Value","Linear Etalon Imaging Spectral Array","",""," Data were obtained using the RALPH/LEISA infrared detector with a waveleght range of 1250 - 2500 nm. "
"nh:Detector:2                       nh:detector_name:2                  Value:MVIC Blue (BLUE) Cha","Value","MVIC Blue (BLUE) Channel","",""," Data were obtained using the blue channel detector. The blue filter covers the range 400-550nm. "
"nh:Detector:2                       nh:detector_name:2                  Value:MVIC Methane (CH4) C","Value","MVIC Methane (CH4) Channel","",""," Data were obtained using the narrow band methane (CH4) channel detector. The CH4 filter covers the range 860-910nm "
"nh:Detector:2                       nh:detector_name:2                  Value:MVIC Near Infrared (","Value","MVIC Near Infrared (NIR) Channel","",""," Data were obtained using the Near IR channel detector. The NIR filter covers the range 780-975nm. "
"nh:Detector:2                       nh:detector_name:2                  Value:MVIC Panchromatic 1 ","Value","MVIC Panchromatic 1 (PAN1) Channel","",""," Data were obtained using the panchromatic channel 1 (one) detector. The filter over the panchromatic detectors is clear; the coverage range is 400-975nm. "
"nh:Detector:2                       nh:detector_name:2                  Value:MVIC Panchromatic 2 ","Value","MVIC Panchromatic 2 (PAN2) Channel","",""," Data were obtained using the panchromatic channel 2 (two) detector. The filter over the panchromatic detectors is clear; the coverage range is 400-975nm. "
"nh:Detector:2                       nh:detector_name:2                  Value:MVIC Panchromatic Fr","Value","MVIC Panchromatic Framing (FRAME) Array","",""," Data were obtained using the panchromatic framing array. The filter over the framing array is clear; the coverage range is 400-975nm. "
"nh:Detector:2                       nh:detector_name:2                  Value:MVIC Red (RED) Chann","Value","MVIC Red (RED) Channel","",""," Data were obtained using the red channel detector. The red filter covers the range 540-700nm. "
"nh:Detector:2                       nh:detector_name:2                  Value:Pluto Energetic Part","Value","Pluto Energetic Particles Spectrometer Science Investigation","",""," Data were obtained using the PEPSSI time-of-flight (TOF) spectrometer that measures ions and electrons over a broad range of energies and pitch angles. "
"nh:Detector:2                       nh:detector_name:2                  Value:Radio Science Experi","Value","Radio Science Experiment","",""," Data were obtained using the REX subsystem comprising the 2.1 m spacecraft high-gain antenna (HGA) and the NH radio receiver as well as the the Deep Space Network (DSN). "
"nh:Detector:2                       nh:detector_name:2                  Value:SWAP Channel Electro","Value","SWAP Channel Electron Multiplier (CEM)","",""," Data were obtained using the SWAP Channel Electron Multiple and counter. "
"nh:Detector:2                       nh:detector_name:2                  Value:Solar Wind Around Pl","Value","Solar Wind Around Pluto","",""," Data were obtained using the SWAP electrostatic analyzer. "
"nh:Detector:2                       nh:detector_name:2                  Value:Student Dust Counter","Value","Student Dust Counter","",""," Data were obtained using the SDC dust imapact counter. "
"nh:Detector:2                       nh:detector_type:1                 ","Attribute","detector_type","n/a","nh"," The nh:detector_type attribute provides a brief indication of the type of hardware comprising the detector. ","sbn","ASCII_Short_String_Collapsed","1","1","Unbounded","Unbounded","1","255","Units_of_None","none","TBD_classConcept","SHORT_STRING"
"nh:Detector:2                       nh:detector_type:2                  Value:CCD","Value","CCD","","","The detector is a standard CCD."
"nh:Detector:2                       nh:detector_type:2                  Value:Dust Impact Counter","Value","Dust Impact Counter","","","The detector is a set of permanently polarized Polyvinylidene Fluoride (PVDF) plastic films that generate an electrical signal when dust particles penetrate their surface. "
"nh:Detector:2                       nh:detector_type:2                  Value:Electrostatic","Value","Electrostatic","","","The detector is an electrostatic low-energy plasma instrument."
"nh:Detector:2                       nh:detector_type:2                  Value:HgCdTe PICNIC array","Value","HgCdTe PICNIC array","","","The detector is a modified HgCdTe 'PICNIC' array from Rockwell Scientific Imaging."
"nh:Detector:2                       nh:detector_type:2                  Value:Local oscillator vs.","Value","Local oscillator vs. uplink signal phase comparator","",""," The detector is a local oscillator vs. uplink signal phase comparator."
"nh:Detector:2                       nh:detector_type:2                  Value:Microchannel plate","Value","Microchannel plate","","","The detector is a Microchannel plate (MCP) which is sensitive to extreme and far UV light and energetic particles."
"nh:Detector:2                       nh:detector_type:2                  Value:SSD","Value","SSD","",""," The detector is a solid-state silicon detector."
"nh:Mission_Elapsed_Time:1          ","Class","Mission_Elapsed_Time","1.0.0.0","nh"," The nh:Mission_Elapsed_Time class provides spacecraft clock partition and count readings for the start and end of the observation(s) comprising the data product. ","sbn","","","","","","","","","","",""
"nh:Mission_Elapsed_Time:2           nh:clock_partition:1               ","Attribute","clock_partition","n/a","nh"," The nh:clock_partition holds the mission clock partition counter. This is a simple integer. ","sbn","ASCII_NonNegative_Integer","1","1","0","18446744073709551615","Unbounded","Unbounded","Units_of_None","none","TBD_classConcept","INTEGER"
"nh:Mission_Elapsed_Time:2           nh:start_clock_count:1             ","Attribute","start_clock_count","n/a","nh"," The nh:start_clock_count is the Mission Elapsed Time code at the start of the observation(s), formatted as spacecraft clock ticks and indicating whole and fractional seconds. ","sbn","ASCII_Short_String_Collapsed","1","1","Unbounded","Unbounded","1","255","Units_of_None","none","TBD_classConcept","SHORT_STRING"
"nh:Mission_Elapsed_Time:2           nh:stop_clock_count:1              ","Attribute","stop_clock_count","n/a","nh"," The nh:stop_clock_count is the Mission Elapsed Time code at the end of the observation(s), formatted as spacecraft clock ticks and indicating whole and fractional seconds. ","sbn","ASCII_Short_String_Collapsed","1","1","Unbounded","Unbounded","1","255","Units_of_None","none","TBD_classConcept","SHORT_STRING"
"nh:Frame_Bias_Levels:1             ","Class","Frame_Bias_Levels","1.0.0.0","nh"," The nh:Frame_Bias_Levels class records the frame number and left/right bias levels for a single frame in a framing observation sequence. In the MVIC detector used for framing observations, the bias level for left and right sides of the detector may vary. Bias levels on each side are measured with every observation through shielded pixels on either side of the detector, the bias values for the pixels from each side them being averaged to return a single median bias level for each side of the detector. These bias levels are reported as left and right median bias levels for each frame. ","sbn","","","","","","","","","","",""
"nh:Frame_Bias_Levels:2              nh:frame_number:1                  ","Attribute","frame_number","n/a","nh"," The nh:frame_number attribute is used to identify a single frame (or image plane) in an observation that is formatted as a 3D image cube. The first frame is numbered ""0"" (zero). ","sbn","ASCII_NonNegative_Integer","1","1","0","18446744073709551615","Unbounded","Unbounded","Units_of_None","none","TBD_classConcept","INTEGER"
"nh:Frame_Bias_Levels:2              nh:left_side_median_bias:1         ","Attribute","left_side_median_bias","n/a","nh"," The nh:left_side_median_bias attribute provides the median bias, in DN, determined by averaging the bias levels for the shielded pixels on the left side of the detector array. ","sbn","ASCII_Real","1","1","-1.0","1.7976931348623157e308","Unbounded","Unbounded","Units_of_Misc","none","TBD_classConcept","REAL"
"nh:Frame_Bias_Levels:2              nh:right_side_median_bias:1        ","Attribute","right_side_median_bias","n/a","nh"," The nh:right_side_median_bias attribute provides the median bias, in DN, determined by averaging the bias levels for the shielded pixels on the right side of the detector array. ","sbn","ASCII_Real","1","1","-1.0","1.7976931348623157e308","Unbounded","Unbounded","Units_of_Misc","none","TBD_classConcept","REAL"
"nh:Framing_Biases:1                ","Class","Framing_Biases","1.0.0.0","nh"," The nh:Framing_Biases class contains one nh:Frame_Bias_Levels class for each individual frame of a framing observation. These classes provide the left and right side bias levels applied in calibrating the data. ","sbn","","","","","","","","","","",""
"nh:MVIC_Calibration_Information:1  ","Class","MVIC_Calibration_Information","1.0.0.0","nh"," The nh:MVIC_Calibration_Information class gathers attributes related to the attributes of the detector and other information relevant to the calibration processing performed to produce the current data product. ","sbn","","","","","","","","","","",""
"nh:MVIC_Calibration_Information:2   nh:physical_pixel_size:1           ","Attribute","physical_pixel_size","n/a","nh"," The nh:physical_pixel_size attribute gives the hardware dimension of a single, square pixel within the detector. ","sbn","ASCII_Real","1","1","0.0","1.7976931348623157e308","Unbounded","Unbounded","Units_of_Length","none","TBD_classConcept","REAL"
"nh:MVIC_Calibration_Information:2   nh:read_noise:1                    ","Attribute","read_noise","n/a","nh"," The nh:read_noise attribute provides the noise level of the detector as a count of electrons. ","sbn","ASCII_Real","1","1","-1.7976931348623157e308","1.7976931348623157e308","Unbounded","Unbounded","Units_of_None","none","TBD_classConcept","REAL"
"nh:MVIC_Calibration_Information:2   nh:gain:1                          ","Attribute","gain","n/a","nh"," The nh:gain attribute provides the gain setting applied in collecting the data, in units of electrons/DN. ","sbn","ASCII_Real","1","1","0.0","1.7976931348623157e308","Unbounded","Unbounded","Units_of_Misc","none","TBD_classConcept","REAL"
"nh:MVIC_Calibration_Information:2   nh:tdi_median_bias_level:1         ","Attribute","tdi_median_bias_level","n/a","nh"," The nh:tdi_median_bias_level attribute gives the median bias level of a time-delay integration observation. For time delay integration (TDI) mode, bias levels in each detector were determined in-flight during early mission phases. They may vary depending on exposure length. See the ""New Horizonz SOC to Instrument Pipeline ICD"" document for details. ","sbn","ASCII_Real","0","1","0.0","1.7976931348623157e308","Unbounded","Unbounded","Units_of_Misc","none","TBD_classConcept","REAL"
"nh:MVIC_Conversion_Constants:1     ","Class","MVIC_Conversion_Constants","1.0.0.0","nh"," This class is deprecated as of version 1.1.0.0. Please use nh:Radiometric_Conversion_Constants instead. The nh:MVIC_Conversion_Constants class provides the values needed to run the conversion from the calibrated pixel values to physical units. This conversion is dependent on the spectral distribition of the source, the MVIC detector wavelength range, and whether or not the source is resolved. A description of how to convert from data values to physical units is provided in the "New Horizons SOC to Instrument Pipeline ICD" document. ","sbn","","","","","","","","","","",""
"nh:MVIC_Conversion_Constants:2      nh:pivot_wavelength:1              ","Attribute","pivot_wavelength","n/a","nh"," The nh:pivot_wavelength is used in converting the pixel values in the calibrated data into physical units for some instruments. It is wavelength-dependent, but once defined is constant for each detector. A description of how to convert from data values to physical units is provided in the ""New Horizons SOC to Instrument Pipeline ICD"" document. ","sbn","ASCII_Real","1","1","0.0","1.7976931348623157e308","Unbounded","Unbounded","Units_of_Length","none","TBD_classConcept","REAL"
"nh:Radiometric_Conversion_Constants:1","Class","Radiometric_Conversion_Constants","1.0.0.0","nh"," The nh:Radiometric_Conversion_Constants class provides the values needed to run the conversion from the calibrated pixel values to physical units for the MVIC and LORRI instruments. This conversion is dependent on the spectral distribition of the source, the detector wavelength range, and whether or not the source is resolved. A description of how to convert from data values to physical units is provided in the "New Horizons SOC to Instrument Pipeline ICD" document. ","sbn","","","","","","","","","","",""
"nh:Radiometric_Conversion_Constants:2 nh:pivot_wavelength:1              ","Attribute","pivot_wavelength","n/a","nh"," The nh:pivot_wavelength is used in converting the pixel values in the calibrated data into physical units for some instruments. It is wavelength-dependent, but once defined is constant for each detector. A description of how to convert from data values to physical units is provided in the ""New Horizons SOC to Instrument Pipeline ICD"" document. ","sbn","ASCII_Real","1","1","0.0","1.7976931348623157e308","Unbounded","Unbounded","Units_of_Length","none","TBD_classConcept","REAL"
"nh:LEISA_Details:1                 ","Class","LEISA_Details","1.0.0.0","nh"," The nh:LEISA_Details class collects observational parameters that are specific to the LEISA instrument. ","sbn","","","","","","","","","","",""
"nh:LEISA_Details:2                  nh:scan_type:1                     ","Attribute","scan_type","n/a","nh"," The nh:scan_type attribute indicates what sort of scanning was employed in collecting the data. ","sbn","ASCII_Short_String_Collapsed","1","1","Unbounded","Unbounded","1","255","Units_of_None","none","TBD_classConcept","SHORT_STRING"
"nh:LEISA_Details:2                  nh:scan_type:2                      Value:LEISA","Value","LEISA","",""," The data were obtained as a sequence of LEISA frames. "
"nh:LEISA_Details:2                  nh:leisa_mode:1                    ","Attribute","leisa_mode","n/a","nh"," The nh:leisa_mode attribute identifies the data collection readout mode of the LEISA instrument, where RAW is for un-subtracted readout mode and SUBTRACTED for correlated double sample (CDS) mode. ","sbn","ASCII_Short_String_Collapsed","0","1","Unbounded","Unbounded","1","255","Units_of_None","none","TBD_classConcept","SHORT_STRING"
"nh:LEISA_Details:2                  nh:leisa_mode:2                     Value:RAW","Value","RAW","",""," The LEISA readout mode is un-subtracted. "
"nh:LEISA_Details:2                  nh:leisa_mode:2                     Value:SUBTRACTED","Value","SUBTRACTED","",""," The LEISA readout mode is subtracted. "
"nh:LEISA_Details:2                  nh:leisa_offset_1:1                ","Attribute","leisa_offset_1","n/a","nh"," The nh:leisa_offset_1 attribute provides the voltage offset, in DN, in the first of the four LEISA quadrants. ","sbn","ASCII_Integer","0","1","0","9223372036854775807","Unbounded","Unbounded","Units_of_Misc","none","TBD_classConcept","INTEGER"
"nh:LEISA_Details:2                  nh:leisa_offset_2:1                ","Attribute","leisa_offset_2","n/a","nh"," The nh:leisa_offset_2 attribute provides the voltage offset, in DN, in the second of the four LEISA quadrants. ","sbn","ASCII_Integer","0","1","0","9223372036854775807","Unbounded","Unbounded","Units_of_Misc","none","TBD_classConcept","INTEGER"
"nh:LEISA_Details:2                  nh:leisa_offset_3:1                ","Attribute","leisa_offset_3","n/a","nh"," The nh:leisa_offset_3 attribute provides the voltage offset, in DN, in the third of the four LEISA quadrants. ","sbn","ASCII_Integer","0","1","0","9223372036854775807","Unbounded","Unbounded","Units_of_Misc","none","TBD_classConcept","INTEGER"
"nh:LEISA_Details:2                  nh:leisa_offset_4:1                ","Attribute","leisa_offset_4","n/a","nh"," The nh:leisa_offset_4 attribute provides the voltage offset, in DN, in the fourth of the four LEISA quadrants. ","sbn","ASCII_Integer","0","1","0","9223372036854775807","Unbounded","Unbounded","Units_of_Misc","none","TBD_classConcept","INTEGER"
"nh:LEISA_Details:2                  nh:leisa_rate:1                    ","Attribute","leisa_rate","n/a","nh"," The nh:leisa_rate attribute provides the time between LEISA readouts. There is zero dead time between frames, so in practice, this value is equivalent to the per-frame exposure time, and the number of frames per second is exactly its reciprocal. ","sbn","ASCII_Real","0","1","0","1.7976931348623157e308","Unbounded","Unbounded","Units_of_Time","none","TBD_classConcept","REAL"
"nh:LEISA_Details:2                  nh:leisa_side:1                    ","Attribute","leisa_side","n/a","nh"," The nh:leisa_side attribute indicates the hardware side in use during the observation sequence. ","sbn","ASCII_Short_String_Collapsed","0","1","Unbounded","Unbounded","1","255","Units_of_None","none","TBD_classConcept","SHORT_STRING"
"nh:LEISA_Details:2                  nh:leisa_side:2                     Value:A","Value","A","",""," The LEISA ""A"" hardware side. "
"nh:LEISA_Details:2                  nh:leisa_side:2                     Value:B","Value","B","",""," The LEISA ""B"" hardware side. "
"nh:LEISA_Details:2                  nh:leisa_temperature:1             ","Attribute","leisa_temperature","n/a","nh"," The nh:leisa_temperature attribute provides the temperature of the LEISA instrument. ","sbn","ASCII_Real","0","1","-273.15","1.7976931348623157e308","Unbounded","Unbounded","Units_of_Temperature","none","TBD_classConcept","REAL"
"nh:MVIC_Details:1                  ","Class","MVIC_Details","1.0.0.0","nh"," The nh:MVIC_Details class collects observational parameters that are specific to the MVIC instrument and its various channels. ","sbn","","","","","","","","","","",""
"nh:MVIC_Details:2                   nh:scan_type:1                     ","Attribute","scan_type","n/a","nh"," The nh:scan_type attribute indicates what sort of scanning was employed in collecting the data. ","sbn","ASCII_Short_String_Collapsed","1","1","Unbounded","Unbounded","1","255","Units_of_None","none","TBD_classConcept","SHORT_STRING"
"nh:MVIC_Details:2                   nh:scan_type:2                      Value:FRAMING - Framing Mo","Value","FRAMING - Framing Mode","",""," The data were obtained as a sequence of 2D image frames. "
"nh:MVIC_Details:2                   nh:scan_type:2                      Value:TDI - Time Delay Int","Value","TDI - Time Delay Integration Mode","",""," The data were obtained using time delayed integration (TDI). The TDI frequency should be provided in the tdi_rate attribute. "
"nh:MVIC_Details:2                   nh:tdi_rate:1                      ","Attribute","tdi_rate","n/a","nh"," The nh:tdi_rate attribute is the rate at which charge was moved through successive rows of the detector in obtaining the observation. This rate was calculated to match the scan rate of the spacecraft. ","sbn","ASCII_Real","0","1","0.0","1.7976931348623157e308","Unbounded","Unbounded","Units_of_Frequency","none","TBD_classConcept","REAL"
"nh:Alice_Details:1                 ","Class","Alice_Details","1.0.0.0","nh"," The Alice_Details class collects observational parameters that are specific to the Alice instrument. ","sbn","","","","","","","","","","",""
"nh:Alice_Details:2                  nh:aperture:1                      ","Attribute","aperture","n/a","nh"," The Alice instrument has two different apertures (i.e., optical paths) through which it can collect data: the ""airglow"" aperture and the solar occultation channel (SOCC). The nh:aperture attribute indicates which was used for a given data product. ","sbn","ASCII_Short_String_Collapsed","1","1","Unbounded","Unbounded","1","255","Units_of_None","none","TBD_classConcept","SHORT_STRING"
"nh:Alice_Details:2                  nh:aperture:2                       Value:Airglow","Value","Airglow","",""," The data were collected through Alice's airglow aperture. "
"nh:Alice_Details:2                  nh:aperture:2                       Value:Solar Occultation Ch","Value","Solar Occultation Channel","",""," The data were obtained via Alice's solar occultation channel (SOCC). "
"nh:Observation_Parameters:1        ","Class","Observation_Parameters","1.0.0.0","nh"," The nh:Observation_Parameters class collects observational metadata that is specific to the mission, spacecraft, and instrument which produced the data product. ","sbn","","","","","","","","","","",""
"nh:Observation_Parameters:2         nh:telemetry_apid:1                ","Attribute","telemetry_apid","n/a","nh"," The nh:telemetry_apid is the application identifier for the observation. The values are specific to instrument and activity. The definitions for apIDs relevant to the archived observations are contained in various tables in the ""New Horizons SOC to Instrument Pipeline ICD document. The apID is used in formulating the file name, among other things. Metadata encoded in the apID is contained in separate metadata elements elsewhere in the label. ","sbn","ASCII_Short_String_Collapsed","1","1","Unbounded","Unbounded","1","255","Units_of_None","none","TBD_classConcept","SHORT_STRING"
"nh:Observation_Parameters:2         nh:sequence_id:1                   ","Attribute","sequence_id","n/a","nh"," The nh:sequence_id provides a long string encoding some infomation about the planned observing sequence. A more human-readable description should be provided in the nh:observation_description element. Each instrument should have an accompanying ancillary/documentation file that lists all the planned sequences for each instrument for each mission phase. ","sbn","ASCII_Short_String_Collapsed","1","1","Unbounded","Unbounded","1","255","Units_of_None","none","TBD_classConcept","SHORT_STRING"
"nh:Observation_Parameters:2         nh:observation_description:1       ","Attribute","observation_description","n/a","nh"," The nh:observation_description element provides a human-readable decoding of the sequence_id string. It provides a basic description of the planned observation activity. Each instrument should have an accompanying ancillary/documentation file that lists all the planned sequences for each instrument for each mission phase. ","sbn","ASCII_Short_String_Collapsed","1","1","Unbounded","Unbounded","1","255","Units_of_None","none","TBD_classConcept","SHORT_STRING"
"nh:Ralph_Details:1                 ","Class","Ralph_Details","1.0.0.0","nh"," The nh:Ralph_Details class presents Ralph common instrument parameters needed for data calibration. ","sbn","","","","","","","","","","",""
"nh:Ralph_Details:2                  nh:met510:1                        ","Attribute","met510","n/a","nh"," The nh:met510 attribute provides the mission elapsed time (MET) of the Ralph housekeeping packet (ApID 0x510) that marks the start of an observation, used to determine the observation start time and frame rate. ","sbn","ASCII_Real","0","1","0","1.7976931348623157e308","Unbounded","Unbounded","Units_of_Time","none","TBD_classConcept","REAL"
"nh:Ralph_Details:2                  nh:hk_packet_is_real:1             ","Attribute","hk_packet_is_real","n/a","nh"," The nh:hk_packet_is_real attribute describes whether the Ralph housekeeping packet (ApID 0x510) is real (true) or assumed from a gap (false). ","sbn","ASCII_Boolean","0","1","Unbounded","Unbounded","Unbounded","Unbounded","Units_of_None","none","TBD_classConcept","BOOLEAN"
